<?xml version="1.0" encoding="utf-8"?>
<!--
To change this template, choose Tools | Templates
and open the template in the editor.
-->


<game name="test" startingScene="1" xmlns:xsi="http://www.w3.org/2001/XMLSchema-instance"
      xsi:noNamespaceSchemaLocation="textGameXmlSchema.xsd">
    <scene id="1">
        <name>First scene</name>
        <description>
            This is first scene of the testing XML game.
        </description>
        <choices>
            <choice goTo="2">
                <text>First choice.</text>
            </choice>
        </choices>
    </scene>
    <scene id="2">
        <name>Second scene</name>
        <description>
            This is second scene of the testing XML game.
        </description>
        <choices>
            <choice goTo="3">
                <text>First choice.</text>
            </choice>
        </choices>
    </scene>
    <scene id="3">
        <name>Third scene</name>
        <description>
            This is third scene of the testing XML game.
        </description>
        <choices>
            <choice goTo="3">
                <text>First choice.</text>
            </choice>
            <choice goTo="5">
                <text>Second choice.</text>
            </choice>
        </choices>
    </scene>
    <scene id="4">
        <name>Fourth scene</name>
        <description>
            Final scene.
        </description>
        <choices/>
    </scene>
    <scene id="5">
        <name>Fifth scene</name>
        <description>
            Final scene.
        </description>
        <choices/>
    </scene>
</game>
