<?xml version="1.0" encoding="utf-8"?>
<!--
To change this template, choose Tools | Templates
and open the template in the editor.
-->


<game name="test" starting_scene="1" xmlns:xsi="http://www.w3.org/2001/XMLSchema-instance"
    xsi:noNamespaceSchemaLocation="textGameXmlSchema.xsd">
    <scene name="first scene" id="1">
        <description>
            This is first scene of the testing XML game.
        </description>
        <choices>
            <choice goTo="2" points="1">
                <text>First choice.</text>
            </choice>
            <choice goTo="3" points="1">
                <text>Second choice.</text>
            </choice>
            <choice goTo="4" points="1">
                <text>Third choice.</text>
            </choice>
        </choices>
    </scene>
    <scene name="second scene" id="2">
        <description>
            This is second scene of the testing XML game.
        </description>
        <choices>
            <choice goTo="1" points="1">
                <text>First choice.</text>
            </choice>
            <choice goTo="3" points="1">
                <text>Second choice.</text>
            </choice>
            <choice goTo="4" points="1">
                <text>Third choice.</text>
            </choice>
        </choices>
    </scene>
    <scene name="third scene" id="3">
        <description>
            This is third scene of the testing XML game.
        </description>
        <choices>
            <choice goTo="1" points="1">
                <text>First choice.</text>
            </choice>
            <choice goTo="2" points="1">
                <text>Second choice.</text>
            </choice>
            <choice goTo="4" points="1">
                <text>Third choice.</text>
            </choice>
        </choices>
    </scene>
    <scene name="fourth scene" id="4">
        <description>
            This is fourth scene of the testing XML game.
        </description>
        <choices>
            <choice goTo="1" points="1">
                <text>First choice.</text>
            </choice>
            <choice goTo="2" points="1">
                <text>Second choice.</text>
            </choice>
            <choice goTo="3" points="1">
                <text>Third choice.</text>
            </choice>
        </choices>
    </scene>
</game>
